{
  "mission_id": "mission-synthetic-001",
  "mission_objective": "bounded synthetic mission-assurance review",
  "subject_id": "synthetic-mission-alpha",
  "configuration_digest": "sha256:899a2dff609159ea1099154f7850696a0bfbabd9d28a5874ab22fda8e256c2f1",
  "accountable_human_ref": "synthetic-accountable-human",
  "target_stage": "G8",
  "reference_only": true,
  "human_decision_required": true,
  "authority_effect": "NONE",
  "known_unknowns": [
    "external authenticity of source artifacts"
  ],
  "blocking_unknowns": [],
  "material_change": false,
  "baseline_reference": {
    "source": "synthetic-reference",
    "artifact_type": "baseline",
    "artifact_id": "baseline-001",
    "schema_version": "1.0.0",
    "subject_id": "synthetic-mission-alpha",
    "configuration_digest": "sha256:899a2dff609159ea1099154f7850696a0bfbabd9d28a5874ab22fda8e256c2f1",
    "artifact_digest": "sha256:ae37dbddc15e8ddc233c4b5065b6376d7bbe1245cdd3d8c96b368aa93c9a9991",
    "authority_effect": "NONE"
  },
  "authority_data_references": [
    {
      "source": "synthetic-reference",
      "artifact_type": "authority-data",
      "artifact_id": "authority-001",
      "schema_version": "1.0.0",
      "subject_id": "synthetic-mission-alpha",
      "configuration_digest": "sha256:899a2dff609159ea1099154f7850696a0bfbabd9d28a5874ab22fda8e256c2f1",
      "artifact_digest": "sha256:86eebb0db18671b51d388714fa9008dbbe548e78499a14c2be882d1d4d158171",
      "authority_effect": "NONE"
    }
  ],
  "qualification_reference": {
    "source": "synthetic-reference",
    "artifact_type": "qualification",
    "artifact_id": "qualification-001",
    "schema_version": "1.0.0",
    "subject_id": "synthetic-mission-alpha",
    "configuration_digest": "sha256:899a2dff609159ea1099154f7850696a0bfbabd9d28a5874ab22fda8e256c2f1",
    "artifact_digest": "sha256:1cf6cb498c7c1740e1f1d89f06c2c0416e1fb7559629171425311e68b7f7eac6",
    "authority_effect": "NONE"
  },
  "adversarial_assurance_reference": {
    "source": "synthetic-reference",
    "artifact_type": "adversarial-assurance",
    "artifact_id": "adversarial-001",
    "schema_version": "1.0.0",
    "subject_id": "synthetic-mission-alpha",
    "configuration_digest": "sha256:899a2dff609159ea1099154f7850696a0bfbabd9d28a5874ab22fda8e256c2f1",
    "artifact_digest": "sha256:e93a29c825ca88f320463aa855b88269ceb1829ab2741227780b89ea1af7ec1f",
    "authority_effect": "NONE"
  },
  "human_readiness_reference": {
    "source": "synthetic-reference",
    "artifact_type": "human-readiness",
    "artifact_id": "human-readiness-001",
    "schema_version": "1.0.0",
    "subject_id": "synthetic-mission-alpha",
    "configuration_digest": "sha256:899a2dff609159ea1099154f7850696a0bfbabd9d28a5874ab22fda8e256c2f1",
    "artifact_digest": "sha256:5c9ab778f5af645fd919ba1ce67fce27a2d7ba3ee87ee2421f386926f23c0f42",
    "authority_effect": "NONE"
  },
  "operational_acceptance_reference": {
    "source": "synthetic-reference",
    "artifact_type": "operational-acceptance",
    "artifact_id": "decision-001",
    "schema_version": "1.0.0",
    "subject_id": "synthetic-mission-alpha",
    "configuration_digest": "sha256:899a2dff609159ea1099154f7850696a0bfbabd9d28a5874ab22fda8e256c2f1",
    "artifact_digest": "sha256:e7dbaa7fdb923febe84e2932e423bee0f761ee68d76ccd145cad2202d665fa62",
    "authority_effect": "NONE"
  },
  "degraded_mode_reference": {
    "source": "synthetic-reference",
    "artifact_type": "degraded-mode",
    "artifact_id": "degraded-001",
    "schema_version": "1.0.0",
    "subject_id": "synthetic-mission-alpha",
    "configuration_digest": "sha256:899a2dff609159ea1099154f7850696a0bfbabd9d28a5874ab22fda8e256c2f1",
    "artifact_digest": "sha256:c192a04e7a081791e62e103d828e581fb74e540f409596e0190e3bc6db7e1f86",
    "authority_effect": "NONE"
  },
  "recovery_reference": {
    "source": "synthetic-reference",
    "artifact_type": "recovery",
    "artifact_id": "recovery-001",
    "schema_version": "1.0.0",
    "subject_id": "synthetic-mission-alpha",
    "configuration_digest": "sha256:899a2dff609159ea1099154f7850696a0bfbabd9d28a5874ab22fda8e256c2f1",
    "artifact_digest": "sha256:cf7a9e2d42643002c04cade4d9d6809675a8a3b5df7f40619b255f095f80f1c0",
    "authority_effect": "NONE"
  },
  "support_owner_reference": {
    "source": "synthetic-reference",
    "artifact_type": "support-owner",
    "artifact_id": "support-001",
    "schema_version": "1.0.0",
    "subject_id": "synthetic-mission-alpha",
    "configuration_digest": "sha256:899a2dff609159ea1099154f7850696a0bfbabd9d28a5874ab22fda8e256c2f1",
    "artifact_digest": "sha256:d7e5179deee4a168e8695aa38a9aa84ab3305ba0a3c3a963f798b01bf2adde12",
    "authority_effect": "NONE"
  },
  "succession_reference": {
    "source": "synthetic-reference",
    "artifact_type": "succession",
    "artifact_id": "succession-001",
    "schema_version": "1.0.0",
    "subject_id": "synthetic-mission-alpha",
    "configuration_digest": "sha256:899a2dff609159ea1099154f7850696a0bfbabd9d28a5874ab22fda8e256c2f1",
    "artifact_digest": "sha256:626a0ed1a8015ec75670b20b4b20c549cd2204577fd664052be925a2cdc894c0",
    "authority_effect": "NONE"
  }
}
